{
  "schemaVersion": "1.0.0",
  "specId": "SAI-VIDEO-QUALITY",
  "sourcePromptOrStoryboard": "Synthetic CI fixture only: excellent candidate reviewed with assisted-human evidence, which must remain preview-only until a human publish review is recorded.",
  "providerOrLocalAdapterId": null,
  "modelIdIfKnown": null,
  "generationSettingsIfKnown": null,
  "output": {
    "filename": "ci-assisted-preview.mp4",
    "durationSeconds": 12,
    "width": 1920,
    "height": 1080,
    "fps": 30,
    "hasAudio": true
  },
  "reviewer": {
    "type": "ASSISTED_HUMAN",
    "reviewTimestamp": "2026-09-09T00:00:00Z",
    "tamilQualityHumanReviewed": false
  },
  "dimensionScores": {
    "VQ-CONTENT-01": 5,
    "VQ-TEMPORAL-01": 5,
    "VQ-IDENTITY-01": 5,
    "VQ-VISUAL-01": 5,
    "VQ-CAMERA-01": 5,
    "VQ-AUDIO-01": 5,
    "VQ-TEXT-01": 5,
    "VQ-DELIVERY-01": 5
  },
  "criticalDefects": [],
  "notes": ["CI logic fixture; confirms assisted evaluation alone cannot produce a publish-candidate decision."],
  "decision": "PREVIEW_CANDIDATE"
}
